{"iso":"ITA","from":1950,"to":2023,"ages":[0,1,5,10,15,20,25,30,35,40,45,50,55,60,65,70,75,80,85,90,95,100],"M":{"qx":[[0.06808,0.0189,0.005296,0.004161,0.006707,0.009336,0.01014,0.01169,0.01493,0.02153,0.03312,0.04932,0.07111,0.1012,0.1498,0.2387,0.3637,0.5302,0.6984,0.8444,0.9274,1],[0.06844,0.01815,0.004948,0.004241,0.006529,0.008533,0.01015,0.01145,0.01458,0.02153,0.03405,0.05103,0.07428,0.1058,0.1611,0.2556,0.3938,0.5667,0.7438,0.8759,0.9451,1],[0.06701,0.01683,0.004848,0.003853,0.006091,0.007998,0.008821,0.0102,0.01324,0.01934,0.03187,0.04918,0.07401,0.1067,0.1595,0.2509,0.3947,0.5671,0.7385,0.8653,0.9367,1],[0.06172,0.01442,0.004689,0.003823,0.005684,0.007551,0.008414,0.009812,0.01216,0.01896,0.031,0.04875,0.0732,0.1081,0.1617,0.2544,0.3935,0.5701,0.7358,0.8554,0.9301,1],[0.05839,0.01192,0.004082,0.003693,0.005853,0.007611,0.008563,0.009841,0.01183,0.01786,0.02862,0.04666,0.07034,0.1027,0.1508,0.2329,0.3583,0.5321,0.6992,0.8316,0.9161,1],[0.05441,0.01094,0.004102,0.003653,0.006221,0.007631,0.008464,0.01014,0.01194,0.01762,0.0291,0.04646,0.06979,0.1046,0.1511,0.2318,0.3676,0.5225,0.6886,0.822,0.9105,1],[0.05234,0.0103,0.003982,0.003464,0.005932,0.007313,0.008028,0.009663,0.0121,0.01838,0.03005,0.04993,0.07722,0.1151,0.1691,0.2605,0.4032,0.5824,0.7539,0.8765,0.9438,1],[0.05449,0.01088,0.004042,0.003753,0.006131,0.007621,0.008117,0.009653,0.01272,0.01806,0.02911,0.04966,0.07808,0.1148,0.1696,0.249,0.379,0.5418,0.7149,0.841,0.9226,1],[0.05218,0.01028,0.003813,0.003195,0.005674,0.007095,0.00778,0.00897,0.01145,0.01667,0.02691,0.04565,0.0718,0.1082,0.1574,0.2324,0.3568,0.5149,0.6903,0.8206,0.9104,1],[0.04972,0.009247,0.003643,0.003135,0.005634,0.007164,0.00767,0.009534,0.01174,0.01673,0.02627,0.04444,0.07101,0.1074,0.1539,0.2279,0.3435,0.5064,0.6685,0.8041,0.8982,1],[0.04753,0.008543,0.003344,0.003125,0.005763,0.007115,0.00777,0.00891,0.01153,0.01762,0.02763,0.04558,0.07331,0.112,0.1635,0.2373,0.3592,0.5325,0.699,0.8453,0.9273,1],[0.04545,0.007631,0.003285,0.003065,0.006081,0.007472,0.007879,0.009356,0.01206,0.01722,0.02693,0.04465,0.0723,0.1095,0.1581,0.2297,0.3445,0.5074,0.6775,0.8157,0.9074,1],[0.04602,0.007561,0.003324,0.002856,0.006131,0.007323,0.007819,0.009188,0.01248,0.01762,0.02765,0.04593,0.07684,0.1167,0.1706,0.2473,0.3659,0.5372,0.7084,0.8494,0.9301,1],[0.04442,0.006856,0.003225,0.002736,0.006558,0.00775,0.008345,0.009544,0.01311,0.0181,0.02825,0.04608,0.07518,0.1178,0.1738,0.2497,0.3682,0.5293,0.7084,0.8409,0.9239,1],[0.04024,0.006161,0.003105,0.002666,0.005793,0.007055,0.007164,0.0089,0.01212,0.01798,0.02714,0.04355,0.07192,0.1125,0.1662,0.24,0.347,0.5002,0.6649,0.8016,0.8967,1],[0.03909,0.005883,0.002736,0.002627,0.005495,0.00624,0.006628,0.008385,0.01247,0.01802,0.02782,0.04425,0.07217,0.1154,0.1746,0.2499,0.3619,0.5187,0.6975,0.8326,0.9216,1],[0.03794,0.005137,0.002736,0.002537,0.005326,0.006081,0.00632,0.00779,0.01097,0.01708,0.02656,0.04219,0.06928,0.1101,0.166,0.2418,0.3439,0.5013,0.6647,0.8153,0.9111,1],[0.03591,0.004858,0.002477,0.002607,0.005336,0.006231,0.006429,0.007522,0.0112,0.01737,0.02648,0.04333,0.06936,0.1089,0.1683,0.2485,0.3483,0.5038,0.6654,0.8219,0.9127,1],[0.03556,0.004958,0.002627,0.002686,0.005296,0.005962,0.006191,0.007601,0.01085,0.01746,0.02721,0.04343,0.06985,0.1119,0.1707,0.2578,0.3608,0.5236,0.6887,0.8308,0.9196,1],[0.0341,0.004659,0.002537,0.002597,0.005614,0.006101,0.00636,0.007551,0.01086,0.01807,0.02811,0.04497,0.07192,0.117,0.1776,0.2728,0.36,0.4964,0.6552,0.7953,0.8907,1],[0.03209,0.004221,0.002597,0.002567,0.005584,0.006002,0.006211,0.007333,0.01016,0.01692,0.02701,0.0425,0.06766,0.1069,0.1615,0.2483,0.354,0.4953,0.6533,0.8186,0.9105,1],[0.03176,0.003932,0.002397,0.002517,0.005445,0.006101,0.006071,0.006767,0.01037,0.01662,0.0272,0.04264,0.06719,0.105,0.1584,0.2432,0.3536,0.5001,0.6596,0.7996,0.8964,1],[0.02983,0.003643,0.002387,0.002307,0.005614,0.006201,0.005972,0.007105,0.01019,0.01624,0.02757,0.0431,0.06696,0.1043,0.1602,0.2399,0.3528,0.4891,0.6439,0.7935,0.8927,1],[0.02861,0.003155,0.002367,0.002407,0.005555,0.005803,0.006002,0.006678,0.009802,0.01605,0.02723,0.04311,0.0663,0.1048,0.1626,0.2422,0.3661,0.5134,0.6782,0.823,0.913,1],[0.02539,0.002766,0.002088,0.002088,0.004948,0.005206,0.005216,0.006499,0.009247,0.01556,0.0275,0.04322,0.06568,0.1029,0.1587,0.2354,0.3555,0.4981,0.6603,0.8063,0.902,1],[0.0227,0.002766,0.002068,0.002078,0.004968,0.005773,0.005236,0.00624,0.009267,0.01576,0.02724,0.04418,0.06817,0.1062,0.1651,0.2449,0.371,0.5156,0.6678,0.8082,0.9001,1],[0.02093,0.002547,0.001938,0.002078,0.004798,0.005405,0.004997,0.00638,0.00892,0.01566,0.02696,0.04445,0.06746,0.1041,0.1611,0.2453,0.3634,0.5069,0.6716,0.8107,0.9045,1],[0.01977,0.002357,0.001918,0.001978,0.004729,0.005644,0.004968,0.005942,0.008821,0.01504,0.02622,0.0437,0.0674,0.1026,0.1589,0.2412,0.357,0.5037,0.6655,0.8049,0.8989,1],[0.0186,0.002337,0.001818,0.001988,0.0045,0.005216,0.004968,0.005743,0.008563,0.01448,0.02564,0.04411,0.06718,0.1012,0.1557,0.2395,0.349,0.4987,0.6504,0.7989,0.8952,1],[0.01678,0.002138,0.001609,0.001928,0.004719,0.005684,0.005226,0.005972,0.008315,0.01383,0.02511,0.04289,0.06623,0.1002,0.1521,0.2344,0.3445,0.4938,0.6516,0.7947,0.8938,1],[0.01618,0.002257,0.001808,0.001978,0.005087,0.005803,0.005226,0.005932,0.008523,0.01377,0.02426,0.04208,0.06671,0.1011,0.1533,0.2357,0.3515,0.4976,0.6556,0.8017,0.8983,1],[0.01548,0.001978,0.001459,0.001729,0.004838,0.005535,0.005097,0.005515,0.007551,0.01285,0.02356,0.04032,0.0655,0.09932,0.1487,0.2314,0.3465,0.492,0.6495,0.7908,0.8889,1],[0.01429,0.001838,0.001419,0.001619,0.00452,0.005296,0.005077,0.005475,0.007819,0.01271,0.02217,0.03841,0.06356,0.09635,0.1436,0.2223,0.3374,0.4802,0.6297,0.7674,0.8721,1],[0.01284,0.002008,0.001249,0.001659,0.00448,0.005415,0.005167,0.005316,0.007561,0.01272,0.02182,0.0396,0.06466,0.09955,0.1483,0.226,0.3465,0.4923,0.654,0.8042,0.9017,1],[0.01237,0.001609,0.001249,0.001439,0.004062,0.005306,0.004729,0.005336,0.007224,0.01203,0.02075,0.03693,0.0615,0.09476,0.1415,0.2141,0.3255,0.4694,0.6168,0.7683,0.8737,1],[0.01129,0.001639,0.001169,0.001439,0.004191,0.005097,0.004828,0.005276,0.007263,0.01176,0.01976,0.03545,0.06092,0.0942,0.1405,0.2123,0.3287,0.4722,0.6258,0.7812,0.8854,1],[0.01098,0.001449,0.001049,0.001409,0.003713,0.004948,0.004928,0.005097,0.006916,0.01199,0.01923,0.03395,0.05872,0.09266,0.1397,0.208,0.3165,0.4683,0.6195,0.7715,0.8767,1],[0.01049,0.001529,0.001139,0.001229,0.003813,0.005147,0.005216,0.005246,0.006916,0.01132,0.01846,0.03318,0.05635,0.09037,0.1345,0.1984,0.3055,0.4484,0.6059,0.7561,0.8687,1],[0.01026,0.001449,0.001029,0.001189,0.003763,0.005376,0.005614,0.005793,0.006827,0.01074,0.01838,0.03051,0.05432,0.08857,0.1321,0.1966,0.298,0.4498,0.6059,0.7547,0.8664,1],[0.009225,0.001289,0.0009096,0.001199,0.004082,0.005425,0.006399,0.006519,0.006926,0.01034,0.0177,0.02955,0.05177,0.08553,0.128,0.1917,0.2876,0.4311,0.596,0.7459,0.8603,1],[0.009048,0.001239,0.0009695,0.001209,0.004201,0.005654,0.006966,0.007075,0.007849,0.01068,0.01707,0.02845,0.04989,0.08241,0.1271,0.1917,0.2846,0.4301,0.5984,0.7442,0.8599,1],[0.009265,0.001299,0.001129,0.001229,0.004241,0.006101,0.007492,0.007928,0.007889,0.01052,0.01745,0.02815,0.04942,0.0814,0.1259,0.1894,0.2805,0.4285,0.599,0.7564,0.8731,1],[0.009225,0.001349,0.0009895,0.001279,0.004121,0.005992,0.006727,0.008256,0.007968,0.01042,0.01726,0.02727,0.04645,0.07809,0.1224,0.184,0.272,0.4133,0.5806,0.7484,0.8664,1],[0.007511,0.001519,0.001089,0.001269,0.003793,0.005107,0.006201,0.007938,0.00774,0.0101,0.01612,0.02686,0.04459,0.07532,0.1207,0.1812,0.2745,0.4123,0.585,0.7477,0.8682,1],[0.007086,0.001269,0.0009795,0.001079,0.003753,0.004769,0.005823,0.008583,0.008434,0.0105,0.01566,0.02678,0.04359,0.07321,0.1185,0.1779,0.2725,0.4065,0.5754,0.7495,0.8708,1],[0.006928,0.001209,0.001009,0.001269,0.003723,0.005246,0.005664,0.008464,0.008999,0.01023,0.01541,0.02516,0.04239,0.0706,0.1154,0.1761,0.2668,0.3965,0.5729,0.746,0.8722,1],[0.006365,0.001189,0.0008696,0.001159,0.003494,0.004838,0.005584,0.007938,0.008672,0.009732,0.01475,0.02497,0.04047,0.06782,0.1122,0.1719,0.2629,0.3889,0.5651,0.7338,0.8626,1],[0.00585,0.001079,0.0008397,0.001069,0.003295,0.004798,0.004997,0.00631,0.007472,0.009673,0.01447,0.0249,0.03941,0.06654,0.1084,0.1701,0.2593,0.387,0.5627,0.7408,0.8711,1],[0.005682,0.0009296,0.0007097,0.001069,0.003245,0.004988,0.004988,0.005694,0.007015,0.009455,0.01421,0.02404,0.03896,0.06509,0.1075,0.1719,0.2614,0.3911,0.5653,0.7474,0.877,1],[0.005583,0.0008097,0.0005998,0.0009296,0.002986,0.004759,0.004689,0.005366,0.006688,0.009227,0.01387,0.02333,0.03871,0.06195,0.1023,0.1651,0.2519,0.3871,0.5569,0.7359,0.8665,1],[0.00481,0.0007597,0.0007097,0.0008696,0.002936,0.004659,0.004918,0.004997,0.006618,0.008702,0.01366,0.02235,0.03688,0.05888,0.0967,0.157,0.2449,0.375,0.5477,0.7304,0.8635,1],[0.004979,0.0008996,0.0006398,0.0008596,0.003015,0.00444,0.004629,0.005077,0.00633,0.00897,0.01327,0.02168,0.03632,0.05663,0.09325,0.1515,0.2404,0.3694,0.5353,0.7266,0.865,1],[0.00487,0.0009096,0.0008297,0.0008596,0.002876,0.004351,0.00454,0.004848,0.005942,0.008672,0.01318,0.02048,0.03484,0.05469,0.08997,0.1478,0.2367,0.3655,0.534,0.7209,0.8604,1],[0.003897,0.0007197,0.0005598,0.0007397,0.002706,0.003733,0.003942,0.004141,0.005674,0.007958,0.0126,0.02046,0.03457,0.05464,0.08761,0.1451,0.2385,0.3744,0.549,0.7363,0.8719,1],[0.004076,0.0006898,0.0004899,0.0006998,0.002497,0.003743,0.003733,0.003942,0.005147,0.007928,0.01198,0.01939,0.03177,0.05169,0.08287,0.1357,0.2208,0.3454,0.514,0.6953,0.8389,1],[0.003857,0.0007197,0.0004899,0.0007197,0.002327,0.003554,0.003793,0.003833,0.004888,0.007442,0.01157,0.01889,0.03104,0.05103,0.08003,0.1337,0.2198,0.3516,0.5286,0.7098,0.8536,1],[0.003847,0.0006798,0.0005099,0.0005099,0.002257,0.003344,0.003603,0.003803,0.004878,0.007482,0.0116,0.01841,0.0305,0.04937,0.0767,0.1257,0.21,0.3409,0.5116,0.6976,0.8433,1],[0.003529,0.0006198,0.0004999,0.0006498,0.002367,0.003275,0.003554,0.003514,0.004798,0.007184,0.01141,0.0181,0.02902,0.04817,0.07